{
  "artifact": {
    "manifest_sha256": "e167334c3fdeb3152b8aaa3e3f9107ad11d33575fce98fddeeeabb822498e1c6",
    "raw_sha256": "b7d639da4beb1118c840b575c2f72851454810e8fb6a54d0a27d67cf7d19e261",
    "summary_sha256": "884fda32faa294a78b2c8423c0bdc5b0bac2ff13be16b10ee7b0e35878dc3f6e",
    "uri": "hf://buckets/Hanno-Labs/training/decision-bench/runs/serial-nonbosun-nonjev-20260920-r8/openjev"
  },
  "benchmark_name": "DecisionBench",
  "benchmark_version": "1.0",
  "coverage": 0.9279497907949791,
  "dataset_repo": "Hanno-Labs/decision-bench",
  "dataset_revision": "b7c8107e01ecb1aee7c7eaf5caee4a3ba9f59443",
  "error_rows": 0,
  "expected_calibration_error": 0.032313508338649696,
  "mean_latency_seconds": 0.028398163661757826,
  "mean_negative_log_likelihood": 1.8058825067503292,
  "model": {
    "adapter": "openjev-hf",
    "name": "com-kotobalabs/open-jev-deberta-v3-large",
    "open_weights": true,
    "parameter_count": 435000000,
    "probability_source": "native_grouped_logits_temperature_softmax",
    "revision": "19bf9a64815add579fbf6c907bef584d9277a8e4",
    "url": "https://huggingface.co/com-kotobalabs/open-jev-deberta-v3-large"
  },
  "primary_accuracy": 0.3817154811715481,
  "requested_rows": 23900,
  "schema_version": "decision-bench-result-v1",
  "submitted_at": "2026-09-20T16:18:33Z",
  "successful_rows": 22178,
  "supported_accuracy": 0.4113535936513662,
  "task_spec_sha256": "a477586be2d19dc109c9f2479e3c455b76e6311758c05f42b5a0ca15f4c34b44",
  "unsupported_rows": 1722,
  "views": {
    "candidate_count:10": {
      "accuracy": 0.29949238578680204,
      "expected_calibration_error": 0.0795041077327186,
      "mean_latency_seconds": 0.026137162387597983,
      "mean_negative_log_likelihood": 2.0382179198731456,
      "rows": 197
    },
    "candidate_count:11": {
      "accuracy": 0.2900763358778626,
      "expected_calibration_error": 0.1300309743781407,
      "mean_latency_seconds": 0.02687627041555998,
      "mean_negative_log_likelihood": 2.170751689613025,
      "rows": 131
    },
    "candidate_count:12": {
      "accuracy": 0.21052631578947367,
      "expected_calibration_error": 0.17438831845913155,
      "mean_latency_seconds": 0.028294083838792224,
      "mean_negative_log_likelihood": 2.687692451818796,
      "rows": 95
    },
    "candidate_count:128": {
      "accuracy": 0.010452961672473868,
      "expected_calibration_error": 0.0022539637916396335,
      "mean_latency_seconds": 0.10226804209314935,
      "mean_negative_log_likelihood": 4.859918401338193,
      "rows": 287
    },
    "candidate_count:13": {
      "accuracy": 0.18181818181818182,
      "expected_calibration_error": 0.25507397546516125,
      "mean_latency_seconds": 0.026578248859467832,
      "mean_negative_log_likelihood": 2.7650545044386505,
      "rows": 55
    },
    "candidate_count:14": {
      "accuracy": 0.20754716981132076,
      "expected_calibration_error": 0.16953829721006347,
      "mean_latency_seconds": 0.02748805210697201,
      "mean_negative_log_likelihood": 2.6166837475801246,
      "rows": 53
    },
    "candidate_count:15": {
      "accuracy": 0.23404255319148937,
      "expected_calibration_error": 0.2569878395227865,
      "mean_latency_seconds": 0.028696097057074942,
      "mean_negative_log_likelihood": 3.043871328847155,
      "rows": 47
    },
    "candidate_count:151": {
      "accuracy": 0.009285051067780872,
      "expected_calibration_error": 0.002344889102756437,
      "mean_latency_seconds": 0.08761491232569794,
      "mean_negative_log_likelihood": 5.018143292882906,
      "rows": 1077
    },
    "candidate_count:16": {
      "accuracy": 0.49607535321821034,
      "expected_calibration_error": 0.21277992702106013,
      "mean_latency_seconds": 0.04085590354396466,
      "mean_negative_log_likelihood": 1.9228945964574016,
      "rows": 637
    },
    "candidate_count:17": {
      "accuracy": 0.08,
      "expected_calibration_error": 0.41954572219428915,
      "mean_latency_seconds": 0.03194933719933033,
      "mean_negative_log_likelihood": 3.350073254261821,
      "rows": 25
    },
    "candidate_count:18": {
      "accuracy": 0.21428571428571427,
      "expected_calibration_error": 0.36974887992624095,
      "mean_latency_seconds": 0.032334867399185896,
      "mean_negative_log_likelihood": 3.1113819928424675,
      "rows": 14
    },
    "candidate_count:19": {
      "accuracy": 0.0,
      "expected_calibration_error": 0.3540514097878391,
      "mean_latency_seconds": 0.03270578294371565,
      "mean_negative_log_likelihood": 3.7444899599104895,
      "rows": 15
    },
    "candidate_count:2": {
      "accuracy": 0.6922317314022383,
      "expected_calibration_error": 0.032651893138760706,
      "mean_latency_seconds": 0.01346933967715903,
      "mean_negative_log_likelihood": 0.5867496080784265,
      "rows": 6076
    },
    "candidate_count:20": {
      "accuracy": 0.09090909090909091,
      "expected_calibration_error": 0.4108155450364664,
      "mean_latency_seconds": 0.02872353538193486,
      "mean_negative_log_likelihood": 3.595729856164141,
      "rows": 22
    },
    "candidate_count:21": {
      "accuracy": 0.0,
      "expected_calibration_error": 0.4322257301994773,
      "mean_latency_seconds": 0.026939591742120683,
      "mean_negative_log_likelihood": 3.991112060599524,
      "rows": 16
    },
    "candidate_count:22": {
      "accuracy": 0.125,
      "expected_calibration_error": 0.30786758159601374,
      "mean_latency_seconds": 0.027871660538949072,
      "mean_negative_log_likelihood": 3.795087160432971,
      "rows": 8
    },
    "candidate_count:23": {
      "accuracy": 0.07692307692307693,
      "expected_calibration_error": 0.42644730579807494,
      "mean_latency_seconds": 0.02923604964206998,
      "mean_negative_log_likelihood": 4.187521191858249,
      "rows": 13
    },
    "candidate_count:24": {
      "accuracy": 0.0,
      "expected_calibration_error": 0.4685495459870774,
      "mean_latency_seconds": 0.03479137838902799,
      "mean_negative_log_likelihood": 4.727874680525647,
      "rows": 11
    },
    "candidate_count:25": {
      "accuracy": 0.2,
      "expected_calibration_error": 0.4250129334491013,
      "mean_latency_seconds": 0.033963137026876214,
      "mean_negative_log_likelihood": 3.9145519638711983,
      "rows": 5
    },
    "candidate_count:26": {
      "accuracy": 0.0,
      "expected_calibration_error": 0.45665877733022203,
      "mean_latency_seconds": 0.02745147030800581,
      "mean_negative_log_likelihood": 5.208590225280292,
      "rows": 10
    },
    "candidate_count:27": {
      "accuracy": 0.0,
      "expected_calibration_error": 0.33185042800124753,
      "mean_latency_seconds": 0.026985925808548927,
      "mean_negative_log_likelihood": 3.7956899244508144,
      "rows": 5
    },
    "candidate_count:28": {
      "accuracy": 0.0,
      "expected_calibration_error": 0.4528679132948715,
      "mean_latency_seconds": 0.04186802435045441,
      "mean_negative_log_likelihood": 4.27448080381063,
      "rows": 6
    },
    "candidate_count:29": {
      "accuracy": 0.0,
      "expected_calibration_error": 0.5216292013813908,
      "mean_latency_seconds": 0.030015234253369272,
      "mean_negative_log_likelihood": 5.006631399637868,
      "rows": 4
    },
    "candidate_count:3": {
      "accuracy": 0.509771986970684,
      "expected_calibration_error": 0.0663983381710352,
      "mean_latency_seconds": 0.013989601257721309,
      "mean_negative_log_likelihood": 1.0327217439919094,
      "rows": 614
    },
    "candidate_count:30": {
      "accuracy": 0.16666666666666666,
      "expected_calibration_error": 0.2823362996785571,
      "mean_latency_seconds": 0.037917873511711754,
      "mean_negative_log_likelihood": 3.665196170874108,
      "rows": 6
    },
    "candidate_count:31": {
      "accuracy": 0.3333333333333333,
      "expected_calibration_error": 0.3662236534701961,
      "mean_latency_seconds": 0.03171351940060655,
      "mean_negative_log_likelihood": 2.180450590864462,
      "rows": 3
    },
    "candidate_count:32": {
      "accuracy": 0.1281618887015177,
      "expected_calibration_error": 0.05246305047352821,
      "mean_latency_seconds": 0.058981472648315846,
      "mean_negative_log_likelihood": 3.3129757998367984,
      "rows": 593
    },
    "candidate_count:33": {
      "accuracy": 0.0,
      "expected_calibration_error": 0.5546159668644879,
      "mean_latency_seconds": 0.03458408801816404,
      "mean_negative_log_likelihood": 3.4918686550156592,
      "rows": 2
    },
    "candidate_count:34": {
      "accuracy": 0.0,
      "expected_calibration_error": 0.2898759234761678,
      "mean_latency_seconds": 0.039392269061257444,
      "mean_negative_log_likelihood": 3.9947157594163976,
      "rows": 3
    },
    "candidate_count:35": {
      "accuracy": 0.0,
      "expected_calibration_error": 0.27600060054089537,
      "mean_latency_seconds": 0.054259109077975154,
      "mean_negative_log_likelihood": 4.324388641870064,
      "rows": 2
    },
    "candidate_count:36": {
      "accuracy": 0.0,
      "expected_calibration_error": 0.21041710329822028,
      "mean_latency_seconds": 0.0425196279771626,
      "mean_negative_log_likelihood": 4.292509777936374,
      "rows": 5
    },
    "candidate_count:37": {
      "accuracy": 0.25,
      "expected_calibration_error": 0.3605461075487373,
      "mean_latency_seconds": 0.03487624379340559,
      "mean_negative_log_likelihood": 3.82425268010822,
      "rows": 4
    },
    "candidate_count:38": {
      "accuracy": 0.16666666666666666,
      "expected_calibration_error": 0.38539972508668774,
      "mean_latency_seconds": 0.03424018947407603,
      "mean_negative_log_likelihood": 4.068604099417503,
      "rows": 6
    },
    "candidate_count:39": {
      "accuracy": 0.0,
      "expected_calibration_error": 0.8465975246631959,
      "mean_latency_seconds": 0.041253972332924604,
      "mean_negative_log_likelihood": 7.172438914583916,
      "rows": 2
    },